{
  "$schema": "../../docs/zh_cn/schemas/subsystem/subsystem_static_attr.schema.json",
  "type": "machine_max:motorbike_controller",
  "basic_durability": 40.0,
  "steering_center": [0, -0.6875, 0.85],
  "min_steering_radius": 3.5,
  "lateral_acceleration": 20.0,
  "max_drift_angular_velocity": 1.8,
  "control_inputs": ["move_control"],
  "max_angle": 35.0,
  "parking_angle": 5.0
}